{
    "$schema": "http://json-schema.org/draft-07/schema#",
    "title": "DataPrep Kit Pipeline Schema",
    "type": "object",
    "required": [
        "schema_version",
        "pipeline_id",
        "steps"
    ],
    "properties": {
        "schema_version": {
            "type": "string",
            "description": "Schema version for compatibility checking"
        },
        "pipeline_id": {
            "type": "string",
            "description": "Unique identifier for this pipeline"
        },
        "created_at": {
            "type": "string",
            "format": "date-time"
        },
        "exported_at": {
            "type": "string",
            "format": "date-time"
        },
        "metadata": {
            "type": "object",
            "properties": {
                "source_name": {
                    "type": "string"
                },
                "import_config": {
                    "type": "object"
                },
                "original_shape": {
                    "type": "object",
                    "properties": {
                        "rows": {
                            "type": "integer"
                        },
                        "columns": {
                            "type": "integer"
                        }
                    }
                }
            }
        },
        "steps": {
            "type": "array",
            "items": {
                "$ref": "action_schema.json"
            }
        },
        "change_log": {
            "type": "array",
            "items": {
                "type": "object",
                "properties": {
                    "change_type": {
                        "type": "string"
                    },
                    "action_id": {
                        "type": "string"
                    },
                    "description": {
                        "type": "string"
                    },
                    "timestamp": {
                        "type": "string",
                        "format": "date-time"
                    }
                }
            }
        }
    }
}